{
  "$schema": "../schemas/implementation-evidence.schema.json",
  "schemaVersion": 6,
  "mode": "planning",
  "commands": [],
  "releaseGates": [],
  "records": [],
  "requirements": [
    {
      "id": "browser-identity-browser-identity",
      "description": "Site fulfills browser-identity-browser-identity",
      "targets": [
        {
          "kind": "contract-item",
          "contractId": "browser_identity",
          "itemKind": "proof-family",
          "itemId": "browser-identity"
        }
      ],
      "recordIds": [],
      "requiredPositiveProofKinds": [
        "end-to-end-test"
      ]
    },
    {
      "id": "document-metadata-composition-browser-interface",
      "description": "Site fulfills document-metadata-composition-browser-interface",
      "targets": [
        {
          "kind": "contract-item",
          "contractId": "document_metadata",
          "itemKind": "page-metadata",
          "itemId": "composition-browser-interface"
        }
      ],
      "recordIds": [],
      "requiredPositiveProofKinds": [
        "end-to-end-test"
      ]
    },
    {
      "id": "document-metadata-composition-catalog-architecture",
      "description": "Site fulfills document-metadata-composition-catalog-architecture",
      "targets": [
        {
          "kind": "contract-item",
          "contractId": "document_metadata",
          "itemKind": "page-metadata",
          "itemId": "composition-catalog-architecture"
        }
      ],
      "recordIds": [],
      "requiredPositiveProofKinds": [
        "end-to-end-test"
      ]
    },
    {
      "id": "document-metadata-composition-catalog-guide",
      "description": "Site fulfills document-metadata-composition-catalog-guide",
      "targets": [
        {
          "kind": "contract-item",
          "contractId": "document_metadata",
          "itemKind": "page-metadata",
          "itemId": "composition-catalog-guide"
        }
      ],
      "recordIds": [],
      "requiredPositiveProofKinds": [
        "end-to-end-test"
      ]
    },
    {
      "id": "document-metadata-composition-cli-interface",
      "description": "Site fulfills document-metadata-composition-cli-interface",
      "targets": [
        {
          "kind": "contract-item",
          "contractId": "document_metadata",
          "itemKind": "page-metadata",
          "itemId": "composition-cli-interface"
        }
      ],
      "recordIds": [],
      "requiredPositiveProofKinds": [
        "end-to-end-test"
      ]
    },
    {
      "id": "document-metadata-composition-cli-interface-v2-migration",
      "description": "Site fulfills document-metadata-composition-cli-interface-v2-migration",
      "targets": [
        {
          "kind": "contract-item",
          "contractId": "document_metadata",
          "itemKind": "page-metadata",
          "itemId": "composition-cli-interface-v2-migration"
        }
      ],
      "recordIds": [],
      "requiredPositiveProofKinds": [
        "end-to-end-test"
      ]
    },
    {
      "id": "document-metadata-composition-composer-mvp",
      "description": "Site fulfills document-metadata-composition-composer-mvp",
      "targets": [
        {
          "kind": "contract-item",
          "contractId": "document_metadata",
          "itemKind": "page-metadata",
          "itemId": "composition-composer-mvp"
        }
      ],
      "recordIds": [],
      "requiredPositiveProofKinds": [
        "end-to-end-test"
      ]
    },
    {
      "id": "document-metadata-composition-composer-reference",
      "description": "Site fulfills document-metadata-composition-composer-reference",
      "targets": [
        {
          "kind": "contract-item",
          "contractId": "document_metadata",
          "itemKind": "page-metadata",
          "itemId": "composition-composer-reference"
        }
      ],
      "recordIds": [],
      "requiredPositiveProofKinds": [
        "end-to-end-test"
      ]
    },
    {
      "id": "document-metadata-composition-composition-authority-migration",
      "description": "Site fulfills document-metadata-composition-composition-authority-migration",
      "targets": [
        {
          "kind": "contract-item",
          "contractId": "document_metadata",
          "itemKind": "page-metadata",
          "itemId": "composition-composition-authority-migration"
        }
      ],
      "recordIds": [],
      "requiredPositiveProofKinds": [
        "end-to-end-test"
      ]
    },
    {
      "id": "document-metadata-composition-composition-concepts",
      "description": "Site fulfills document-metadata-composition-composition-concepts",
      "targets": [
        {
          "kind": "contract-item",
          "contractId": "document_metadata",
          "itemKind": "page-metadata",
          "itemId": "composition-composition-concepts"
        }
      ],
      "recordIds": [],
      "requiredPositiveProofKinds": [
        "end-to-end-test"
      ]
    },
    {
      "id": "document-metadata-composition-composition-model",
      "description": "Site fulfills document-metadata-composition-composition-model",
      "targets": [
        {
          "kind": "contract-item",
          "contractId": "document_metadata",
          "itemKind": "page-metadata",
          "itemId": "composition-composition-model"
        }
      ],
      "recordIds": [],
      "requiredPositiveProofKinds": [
        "end-to-end-test"
      ]
    },
    {
      "id": "document-metadata-composition-composition-state",
      "description": "Site fulfills document-metadata-composition-composition-state",
      "targets": [
        {
          "kind": "contract-item",
          "contractId": "document_metadata",
          "itemKind": "page-metadata",
          "itemId": "composition-composition-state"
        }
      ],
      "recordIds": [],
      "requiredPositiveProofKinds": [
        "end-to-end-test"
      ]
    },
    {
      "id": "document-metadata-composition-consumer-guide",
      "description": "Site fulfills document-metadata-composition-consumer-guide",
      "targets": [
        {
          "kind": "contract-item",
          "contractId": "document_metadata",
          "itemKind": "page-metadata",
          "itemId": "composition-consumer-guide"
        }
      ],
      "recordIds": [],
      "requiredPositiveProofKinds": [
        "end-to-end-test"
      ]
    },
    {
      "id": "document-metadata-composition-contract-evolution",
      "description": "Site fulfills document-metadata-composition-contract-evolution",
      "targets": [
        {
          "kind": "contract-item",
          "contractId": "document_metadata",
          "itemKind": "page-metadata",
          "itemId": "composition-contract-evolution"
        }
      ],
      "recordIds": [],
      "requiredPositiveProofKinds": [
        "end-to-end-test"
      ]
    },
    {
      "id": "document-metadata-composition-documentation-index",
      "description": "Site fulfills document-metadata-composition-documentation-index",
      "targets": [
        {
          "kind": "contract-item",
          "contractId": "document_metadata",
          "itemKind": "page-metadata",
          "itemId": "composition-documentation-index"
        }
      ],
      "recordIds": [],
      "requiredPositiveProofKinds": [
        "end-to-end-test"
      ]
    },
    {
      "id": "document-metadata-composition-evaluation-guide",
      "description": "Site fulfills document-metadata-composition-evaluation-guide",
      "targets": [
        {
          "kind": "contract-item",
          "contractId": "document_metadata",
          "itemKind": "page-metadata",
          "itemId": "composition-evaluation-guide"
        }
      ],
      "recordIds": [],
      "requiredPositiveProofKinds": [
        "end-to-end-test"
      ]
    },
    {
      "id": "document-metadata-composition-generated-contract-manifest",
      "description": "Site fulfills document-metadata-composition-generated-contract-manifest",
      "targets": [
        {
          "kind": "contract-item",
          "contractId": "document_metadata",
          "itemKind": "page-metadata",
          "itemId": "composition-generated-contract-manifest"
        }
      ],
      "recordIds": [],
      "requiredPositiveProofKinds": [
        "end-to-end-test"
      ]
    },
    {
      "id": "document-metadata-composition-implementation-evidence",
      "description": "Site fulfills document-metadata-composition-implementation-evidence",
      "targets": [
        {
          "kind": "contract-item",
          "contractId": "document_metadata",
          "itemKind": "page-metadata",
          "itemId": "composition-implementation-evidence"
        }
      ],
      "recordIds": [],
      "requiredPositiveProofKinds": [
        "end-to-end-test"
      ]
    },
    {
      "id": "document-metadata-composition-implementation-evidence-v2-migration",
      "description": "Site fulfills document-metadata-composition-implementation-evidence-v2-migration",
      "targets": [
        {
          "kind": "contract-item",
          "contractId": "document_metadata",
          "itemKind": "page-metadata",
          "itemId": "composition-implementation-evidence-v2-migration"
        }
      ],
      "recordIds": [],
      "requiredPositiveProofKinds": [
        "end-to-end-test"
      ]
    },
    {
      "id": "document-metadata-composition-implementation-evidence-v3-migration",
      "description": "Site fulfills document-metadata-composition-implementation-evidence-v3-migration",
      "targets": [
        {
          "kind": "contract-item",
          "contractId": "document_metadata",
          "itemKind": "page-metadata",
          "itemId": "composition-implementation-evidence-v3-migration"
        }
      ],
      "recordIds": [],
      "requiredPositiveProofKinds": [
        "end-to-end-test"
      ]
    },
    {
      "id": "document-metadata-composition-implementation-evidence-v4-migration",